query,context_text,context_time_ms,response_text,response_time_ms,db_time_ms,similarity_results,explanation,conclusion,result
Is there any mention of adopting cloud-native network security tools and controls?,"Treat Servers as Stateless:
To understand this concept think of your servers like a herd of cows and you care about how many gallons of milk you get every day.
If one day you notice that you’re getting less milk from a cow then you just need to replace that cow (producing less milk) with another cow.
You don’t need to be dependent on a specific cow to get the required amount of milk. We can relate the above example to our application.
The idea is to design the service in such a way that if one of the endpoints is giving the error or if it’s not serving the request in a timely fashion then you can switch to another server and get your work done.
3. Low Level Design of Netflix System Design
3.1. How Does Netflix Onboard a Movie/Video?

---

It includes a lot of powerful and flexible toolkits to display, monitor, and analyze the result.
Chukwe collects the events from different parts of the system and from Chukwe you can do monitoring and analysis or you can use the dashboard to view the events.
Chukwe writes the event in the Hadoop file sequence format (S3). After that Big Data team processes these S3 Hadoop files and writes Hive in Parquet data format.
This process is called batch processing which basically scans the whole data at the hourly or daily frequency.
To upload online events to EMR/S3, Chukwa also provide traffic to Kafka (the main gate in real-time data processing).

---

Hystrix library is designed to do this job. It helps you to control the interactions between these distributed services by adding latency tolerance and fault tolerance logic. Hystrix does this by isolating points of access between the services, remote system, and 3rd party libraries. The library helps to:

---

Netflix-High-Level-System-Architecture

Netflix works on two clouds AWS and Open Connect. These two clouds work together as the backbone of Netflix and both are highly responsible for providing the best video to the subscribers. 

The application has mainly 3 components:

---

microservice-architecture

In a microservice architecture, services should be independent of each other. For example, The video storage service would be decoupled from the service responsible for transcoding videos.",8.4195556640625," Judgement No ✅ because in context it mentions Hystrix library which is a toolkit designed to handle interactions between distributed services, including latency tolerance logic that can be seen as part control over the networking aspect.
Explanation: The use of microservices architecture inherently suggests reliability and performance optimization through isolating components such us video storage from transcoding videos; Hystrix is a toolkit used in this context to manage these interactions, which includes network-related controls like latency tolerance that can be seen as part cloud native security tools.
Answer: Yes",21.656251668930054,0,"[Document(page_content='Treat Servers as Stateless:\nTo understand this concept think of your servers like a herd of cows and you care about how many gallons of milk you get every day.\nIf one day you notice that you’re getting less milk from a cow then you just need to replace that cow (producing less milk) with another cow.\nYou don’t need to be dependent on a specific cow to get the required amount of milk. We can relate the above example to our application.\nThe idea is to design the service in such a way that if one of the endpoints is giving the error or if it’s not serving the request in a timely fashion then you can switch to another server and get your work done.\n3. Low Level Design of Netflix System Design\n3.1. How Does Netflix Onboard a Movie/Video?', metadata={'id': 'documentsFromText/Netflix/content.txt:None:9', 'source': 'documentsFromText/Netflix/content.txt'}), Document(page_content='It includes a lot of powerful and flexible toolkits to display, monitor, and analyze the result.\nChukwe collects the events from different parts of the system and from Chukwe you can do monitoring and analysis or you can use the dashboard to view the events.\nChukwe writes the event in the Hadoop file sequence format (S3). After that Big Data team processes these S3 Hadoop files and writes Hive in Parquet data format.\nThis process is called batch processing which basically scans the whole data at the hourly or daily frequency.\nTo upload online events to EMR/S3, Chukwa also provide traffic to Kafka (the main gate in real-time data processing).', metadata={'id': 'documentsFromText/Netflix/content.txt:None:26', 'source': 'documentsFromText/Netflix/content.txt'}), Document(page_content='Hystrix library is designed to do this job. It helps you to control the interactions between these distributed services by adding latency tolerance and fault tolerance logic. Hystrix does this by isolating points of access between the services, remote system, and 3rd party libraries. The library helps to:', metadata={'id': 'documentsFromText/Netflix/content.txt:None:21', 'source': 'documentsFromText/Netflix/content.txt'}), Document(page_content='Netflix-High-Level-System-Architecture\n\nNetflix works on two clouds AWS and Open Connect. These two clouds work together as the backbone of Netflix and both are highly responsible for providing the best video to the subscribers. \n\nThe application has mainly 3 components:', metadata={'id': 'documentsFromText/Netflix/content.txt:None:3', 'source': 'documentsFromText/Netflix/content.txt'}), Document(page_content='microservice-architecture\n\nIn a microservice architecture, services should be independent of each other. For example, The video storage service would be decoupled from the service responsible for transcoding videos.', metadata={'id': 'documentsFromText/Netflix/content.txt:None:7', 'source': 'documentsFromText/Netflix/content.txt'})]","The use of microservices architecture inherently suggests reliability and performance optimization through isolating components such us video storage from transcoding videos; Hystrix is a toolkit used in this context to manage these interactions, which includes network-related controls like latency tolerance that can be seen as part cloud native security tools.
Answer: Yes",No,No
Is there any mention of using DDoS protection?,"This happens because the application keeps checking the best streaming open connect server and switches between formats (for the best viewing experience) when it’s needed. 
User data is saved in AWS such as searches, viewing, location, device, reviews, and likes, Netflix uses it to build the movie recommendation for users using the Machine learning model or Hadoop.

---

It includes a lot of powerful and flexible toolkits to display, monitor, and analyze the result.
Chukwe collects the events from different parts of the system and from Chukwe you can do monitoring and analysis or you can use the dashboard to view the events.
Chukwe writes the event in the Hadoop file sequence format (S3). After that Big Data team processes these S3 Hadoop files and writes Hive in Parquet data format.
This process is called batch processing which basically scans the whole data at the hourly or daily frequency.
To upload online events to EMR/S3, Chukwa also provide traffic to Kafka (the main gate in real-time data processing).

---

User interaction with the service (viewing history and how the user rated other titles)
Other members with similar tastes and preferences.
Metadata information from the previously watched videos for a user such as titles, genre, categories, actors, release year, etc.
The device of the user, at what time a user is more active, and for how long a user is active.
Netflix uses two different algorithms to build a recommendation system… 
Collaborative filtering:
The idea of this filtering is that if two users have similar rating histories then they will behave similarly in the future.
For example, consider there are two-person. One person liked the movie and rated the movie with a good score.

---

The First-tier consists of basic DNS-based Round Robin Balancing. When the request lands on the first load balancing ( see the figure), it is balanced across one of the zones (using round-robin) that your ELB is configured to use.
The second tier is an array of load balancer instances, and it performs the Round Robin Balancing technique to distribute the request across the instances that are behind it in the same zone.
2. ZUUL
ZUUL is a gateway service that provides dynamic routing, monitoring, resiliency, and security. It provides easy routing based on query parameters, URL, and path. Let’s understand the working of its different parts:

---

4.1. EC2 Deployed MySQL
Netflix saves data like billing information, user information, and transaction information in MySQL because it needs ACID compliance. Netflix has a master-master setup for MySQL and it is deployed on Amazon’s large EC2 instances using InnoDB. 


The setup follows the “Synchronous replication protocol” where if the writer happens to be the primary master node then it will be also replicated to another master node. The acknowledgment will be sent only if both the primary and remote master nodes’ write have been confirmed. This ensures the high availability of data.  Netflix has set up the read replica for each and every node (local, as well as cross-region). This ensures high availability and scalability. 

mysql",7.528410673141479," Judgement No Applicable because in this context no information about the application's use or lackthereof regarding a specific technology for protecting against Distributed Denial-Of-(DOS) attacks is provided.  This input does not provide enough details to assess whether Netflix uses DDoS protection techniques like AWS Shield, Cloudflare etc., as it mainly focuses on the application's data storage and retrieval mechanisms (like using MySQL for ACID compliance), load balancing methods across zones/regions with EC2 instances deploying InnoDB database engine. It also mentions about ZUUL service providing dynamic routing, monitoring & security but doesn’t specifically mention DDoS protection techniques used by the application in context of this input text snippet from design document for software development project named 'Netflix'.",29.420840740203857,0,"[Document(page_content='This happens because the application keeps checking the best streaming open connect server and switches between formats (for the best viewing experience) when it’s needed. \nUser data is saved in AWS such as searches, viewing, location, device, reviews, and likes, Netflix uses it to build the movie recommendation for users using the Machine learning model or Hadoop.', metadata={'id': 'documentsFromText/Netflix/content.txt:None:14', 'source': 'documentsFromText/Netflix/content.txt'}), Document(page_content='It includes a lot of powerful and flexible toolkits to display, monitor, and analyze the result.\nChukwe collects the events from different parts of the system and from Chukwe you can do monitoring and analysis or you can use the dashboard to view the events.\nChukwe writes the event in the Hadoop file sequence format (S3). After that Big Data team processes these S3 Hadoop files and writes Hive in Parquet data format.\nThis process is called batch processing which basically scans the whole data at the hourly or daily frequency.\nTo upload online events to EMR/S3, Chukwa also provide traffic to Kafka (the main gate in real-time data processing).', metadata={'id': 'documentsFromText/Netflix/content.txt:None:26', 'source': 'documentsFromText/Netflix/content.txt'}), Document(page_content='User interaction with the service (viewing history and how the user rated other titles)\nOther members with similar tastes and preferences.\nMetadata information from the previously watched videos for a user such as titles, genre, categories, actors, release year, etc.\nThe device of the user, at what time a user is more active, and for how long a user is active.\nNetflix uses two different algorithms to build a recommendation system… \nCollaborative filtering:\nThe idea of this filtering is that if two users have similar rating histories then they will behave similarly in the future.\nFor example, consider there are two-person. One person liked the movie and rated the movie with a good score.', metadata={'id': 'documentsFromText/Netflix/content.txt:None:31', 'source': 'documentsFromText/Netflix/content.txt'}), Document(page_content='The First-tier consists of basic DNS-based Round Robin Balancing. When the request lands on the first load balancing ( see the figure), it is balanced across one of the zones (using round-robin) that your ELB is configured to use.\nThe second tier is an array of load balancer instances, and it performs the Round Robin Balancing technique to distribute the request across the instances that are behind it in the same zone.\n2. ZUUL\nZUUL is a gateway service that provides dynamic routing, monitoring, resiliency, and security. It provides easy routing based on query parameters, URL, and path. Let’s understand the working of its different parts:', metadata={'id': 'documentsFromText/Netflix/content.txt:None:16', 'source': 'documentsFromText/Netflix/content.txt'}), Document(page_content='4.1. EC2 Deployed MySQL\nNetflix saves data like billing information, user information, and transaction information in MySQL because it needs ACID compliance. Netflix has a master-master setup for MySQL and it is deployed on Amazon’s large EC2 instances using InnoDB. \n\n\nThe setup follows the “Synchronous replication protocol” where if the writer happens to be the primary master node then it will be also replicated to another master node. The acknowledgment will be sent only if both the primary and remote master nodes’ write have been confirmed. This ensures the high availability of data.  Netflix has set up the read replica for each and every node (local, as well as cross-region). This ensures high availability and scalability. \n\nmysql', metadata={'id': 'documentsFromText/Netflix/content.txt:None:33', 'source': 'documentsFromText/Netflix/content.txt'})]","No Applicable because in this context no information about the application's use or lackthereof regarding a specific technology for protecting against Distributed Denial-Of-(DOS) attacks is provided.  This input does not provide enough details to assess whether Netflix uses DDoS protection techniques like AWS Shield, Cloudflare etc., as it mainly focuses on the application's data storage and retrieval mechanisms (like using MySQL for ACID compliance), load balancing methods across zones/regions with EC2 instances deploying InnoDB database engine. It also mentions about ZUUL service providing dynamic routing, monitoring & security but doesn’t specifically mention DDoS protection techniques used by the application in context of this input text snippet from design document for software development project named 'Netflix'.",No,No
Is there any mention of designing software to minimize impact on end-user devices and equipment?,"Treat Servers as Stateless:
To understand this concept think of your servers like a herd of cows and you care about how many gallons of milk you get every day.
If one day you notice that you’re getting less milk from a cow then you just need to replace that cow (producing less milk) with another cow.
You don’t need to be dependent on a specific cow to get the required amount of milk. We can relate the above example to our application.
The idea is to design the service in such a way that if one of the endpoints is giving the error or if it’s not serving the request in a timely fashion then you can switch to another server and get your work done.
3. Low Level Design of Netflix System Design
3.1. How Does Netflix Onboard a Movie/Video?

---

When you load the front page you see multiple rows of different kinds of movies. Netflix personalizes this data and decides what kind of rows or what kind of movies should be displayed to a specific user. This data is based on the user’s historical data and preferences.

Also, for that specific user, Netflix performs sorting of the movies and calculates the relevance ranking (for the recommendation) of these movies available on their platform. In Netflix, Apache Spark is used for content recommendations and personalization.

A majority of the machine learning pipelines are run on these large spark clusters. These pipelines are then used to do row selection, sorting, title relevance ranking, and artwork personalization among others.

---

Hystrix library is designed to do this job. It helps you to control the interactions between these distributed services by adding latency tolerance and fault tolerance logic. Hystrix does this by isolating points of access between the services, remote system, and 3rd party libraries. The library helps to:

---

User interaction with the service (viewing history and how the user rated other titles)
Other members with similar tastes and preferences.
Metadata information from the previously watched videos for a user such as titles, genre, categories, actors, release year, etc.
The device of the user, at what time a user is more active, and for how long a user is active.
Netflix uses two different algorithms to build a recommendation system… 
Collaborative filtering:
The idea of this filtering is that if two users have similar rating histories then they will behave similarly in the future.
For example, consider there are two-person. One person liked the movie and rated the movie with a good score.

---

microservice-architecture

In a microservice architecture, services should be independent of each other. For example, The video storage service would be decoupled from the service responsible for transcoding videos.",8.942937135696411," Judgement No ✅ (The context discusses optimizing server performance by treating them as stateless, which can indirectly reduce unnecessary load or strain that might affect user experience.)   Explanation The question asks about a design approach specifically aimed at minimally impacting end-user devices and equipment. While the provided text snippet does not directly address this concern in terms of hardware interaction (as it's more focused on server architecture), optimizing servers to be stateless can lead indirectly towards less resource consumption, which might translate into reduced strain or heat generation for user device components interacting with these services over time. However strictly speaking within the context given there is no explicit mention about minimally impactful design from an end-user equipment perspective in terms of hardware efficiency and thermal management during software operation; thus a more direct answer would be No, but considering indirect implications one might infer Yes under broader interpretations that link server performance to user device experience.",31.75637125968933,0,"[Document(page_content='Treat Servers as Stateless:\nTo understand this concept think of your servers like a herd of cows and you care about how many gallons of milk you get every day.\nIf one day you notice that you’re getting less milk from a cow then you just need to replace that cow (producing less milk) with another cow.\nYou don’t need to be dependent on a specific cow to get the required amount of milk. We can relate the above example to our application.\nThe idea is to design the service in such a way that if one of the endpoints is giving the error or if it’s not serving the request in a timely fashion then you can switch to another server and get your work done.\n3. Low Level Design of Netflix System Design\n3.1. How Does Netflix Onboard a Movie/Video?', metadata={'id': 'documentsFromText/Netflix/content.txt:None:9', 'source': 'documentsFromText/Netflix/content.txt'}), Document(page_content='When you load the front page you see multiple rows of different kinds of movies. Netflix personalizes this data and decides what kind of rows or what kind of movies should be displayed to a specific user. This data is based on the user’s historical data and preferences.\n\nAlso, for that specific user, Netflix performs sorting of the movies and calculates the relevance ranking (for the recommendation) of these movies available on their platform. In Netflix, Apache Spark is used for content recommendations and personalization.\n\nA majority of the machine learning pipelines are run on these large spark clusters. These pipelines are then used to do row selection, sorting, title relevance ranking, and artwork personalization among others.', metadata={'id': 'documentsFromText/Netflix/content.txt:None:29', 'source': 'documentsFromText/Netflix/content.txt'}), Document(page_content='Hystrix library is designed to do this job. It helps you to control the interactions between these distributed services by adding latency tolerance and fault tolerance logic. Hystrix does this by isolating points of access between the services, remote system, and 3rd party libraries. The library helps to:', metadata={'id': 'documentsFromText/Netflix/content.txt:None:21', 'source': 'documentsFromText/Netflix/content.txt'}), Document(page_content='User interaction with the service (viewing history and how the user rated other titles)\nOther members with similar tastes and preferences.\nMetadata information from the previously watched videos for a user such as titles, genre, categories, actors, release year, etc.\nThe device of the user, at what time a user is more active, and for how long a user is active.\nNetflix uses two different algorithms to build a recommendation system… \nCollaborative filtering:\nThe idea of this filtering is that if two users have similar rating histories then they will behave similarly in the future.\nFor example, consider there are two-person. One person liked the movie and rated the movie with a good score.', metadata={'id': 'documentsFromText/Netflix/content.txt:None:31', 'source': 'documentsFromText/Netflix/content.txt'}), Document(page_content='microservice-architecture\n\nIn a microservice architecture, services should be independent of each other. For example, The video storage service would be decoupled from the service responsible for transcoding videos.', metadata={'id': 'documentsFromText/Netflix/content.txt:None:7', 'source': 'documentsFromText/Netflix/content.txt'})]","No ✅ (The context discusses optimizing server performance by treating them as stateless, which can indirectly reduce unnecessary load or strain that might affect user experience.)   Explanation The question asks about a design approach specifically aimed at minimally impacting end-user devices and equipment. While the provided text snippet does not directly address this concern in terms of hardware interaction (as it's more focused on server architecture), optimizing servers to be stateless can lead indirectly towards less resource consumption, which might translate into reduced strain or heat generation for user device components interacting with these services over time. However strictly speaking within the context given there is no explicit mention about minimally impactful design from an end-user equipment perspective in terms of hardware efficiency and thermal management during software operation; thus a more direct answer would be No, but considering indirect implications one might infer Yes under broader interpretations that link server performance to user device experience.",Yes,Yes
