query,context_text,context_time_ms,response_text,response_time_ms,db_time_ms,similarity_results,explanation,conclusion,result
Is there any mention of minimizing the total number of deployed environments?,"Netflix uses Kafka and Apache Chukwe to ingest the data which is produced in a different part of the system. Netflix provides almost 500B data events that consume 1.3 PB/day and 8 million events that consume 24 GB/Second during peak time. These events include information like:

Error logs
UI activities
Performance events
Video viewing activities
Troubleshooting and diagnostic events.
Apache Chukwe is an open-source data collection system for collecting logs or events from a distributed system. It is built on top of HDFS and Map-reduce framework. It comes with Hadoop’s scalability and robustness features.

---

Treat Servers as Stateless:
To understand this concept think of your servers like a herd of cows and you care about how many gallons of milk you get every day.
If one day you notice that you’re getting less milk from a cow then you just need to replace that cow (producing less milk) with another cow.
You don’t need to be dependent on a specific cow to get the required amount of milk. We can relate the above example to our application.
The idea is to design the service in such a way that if one of the endpoints is giving the error or if it’s not serving the request in a timely fashion then you can switch to another server and get your work done.
3. Low Level Design of Netflix System Design
3.1. How Does Netflix Onboard a Movie/Video?

---

Hystrix library is designed to do this job. It helps you to control the interactions between these distributed services by adding latency tolerance and fault tolerance logic. Hystrix does this by isolating points of access between the services, remote system, and 3rd party libraries. The library helps to:

---

microservice-architecture

In a microservice architecture, services should be independent of each other. For example, The video storage service would be decoupled from the service responsible for transcoding videos.

---

Netflix divided the data into two parts:

Live Viewing History (LiveVH):
This section included the small number of recent viewing historical data of users with frequent updates. The data is frequently used for the ETL jobs and stored in uncompressed form.
Compressed Viewing History (CompressedVH):
A large amount of older viewing records with rare updates is categorized in this section. The data is stored in a single column per row key, also in compressed form to reduce the storage footprin",4.476798534393311," Judgement No ✅  📝 Explanation Netflix's design document mentions treating servers as stateless and dividing data into two parts, implying a strategy to optimize resource usage which can include reducing deployments. However without explicit mention in the provided context about minimizing deployed environments specifically through this approach or technology mentioned (Kafka/Apache Chukwe), we cannot confirm it directly from these details alone ⛹️‍♀️
Response: No, there is no direct information given to suggest that Netflix's design aims at reducing the total number of deployments.",21.379640102386475,0,"[Document(page_content='Netflix uses Kafka and Apache Chukwe to ingest the data which is produced in a different part of the system. Netflix provides almost 500B data events that consume 1.3 PB/day and 8 million events that consume 24 GB/Second during peak time. These events include information like:\n\nError logs\nUI activities\nPerformance events\nVideo viewing activities\nTroubleshooting and diagnostic events.\nApache Chukwe is an open-source data collection system for collecting logs or events from a distributed system. It is built on top of HDFS and Map-reduce framework. It comes with Hadoop’s scalability and robustness features.', metadata={'id': 'documentsFromText/Netflix/content.txt:None:25', 'source': 'documentsFromText/Netflix/content.txt'}), Document(page_content='Treat Servers as Stateless:\nTo understand this concept think of your servers like a herd of cows and you care about how many gallons of milk you get every day.\nIf one day you notice that you’re getting less milk from a cow then you just need to replace that cow (producing less milk) with another cow.\nYou don’t need to be dependent on a specific cow to get the required amount of milk. We can relate the above example to our application.\nThe idea is to design the service in such a way that if one of the endpoints is giving the error or if it’s not serving the request in a timely fashion then you can switch to another server and get your work done.\n3. Low Level Design of Netflix System Design\n3.1. How Does Netflix Onboard a Movie/Video?', metadata={'id': 'documentsFromText/Netflix/content.txt:None:9', 'source': 'documentsFromText/Netflix/content.txt'}), Document(page_content='Hystrix library is designed to do this job. It helps you to control the interactions between these distributed services by adding latency tolerance and fault tolerance logic. Hystrix does this by isolating points of access between the services, remote system, and 3rd party libraries. The library helps to:', metadata={'id': 'documentsFromText/Netflix/content.txt:None:21', 'source': 'documentsFromText/Netflix/content.txt'}), Document(page_content='microservice-architecture\n\nIn a microservice architecture, services should be independent of each other. For example, The video storage service would be decoupled from the service responsible for transcoding videos.', metadata={'id': 'documentsFromText/Netflix/content.txt:None:7', 'source': 'documentsFromText/Netflix/content.txt'}), Document(page_content='Netflix divided the data into two parts:\n\nLive Viewing History (LiveVH):\nThis section included the small number of recent viewing historical data of users with frequent updates. The data is frequently used for the ETL jobs and stored in uncompressed form.\nCompressed Viewing History (CompressedVH):\nA large amount of older viewing records with rare updates is categorized in this section. The data is stored in a single column per row key, also in compressed form to reduce the storage footprin', metadata={'id': 'documentsFromText/Netflix/content.txt:None:36', 'source': 'documentsFromText/Netflix/content.txt'})]","No ✅  📝 Explanation Netflix's design document mentions treating servers as stateless and dividing data into two parts, implying a strategy to optimize resource usage which can include reducing deployments. However without explicit mention in the provided context about minimizing deployed environments specifically through this approach or technology mentioned (Kafka/Apache Chukwe), we cannot confirm it directly from these details alone ⛹️‍♀️
Response: No, there is no direct information given to suggest that Netflix's design aims at reducing the total number of deployments.",No,No
Is there any mention of optimizing storage utilization?,"Netflix uses Kafka and Apache Chukwe to ingest the data which is produced in a different part of the system. Netflix provides almost 500B data events that consume 1.3 PB/day and 8 million events that consume 24 GB/Second during peak time. These events include information like:

Error logs
UI activities
Performance events
Video viewing activities
Troubleshooting and diagnostic events.
Apache Chukwe is an open-source data collection system for collecting logs or events from a distributed system. It is built on top of HDFS and Map-reduce framework. It comes with Hadoop’s scalability and robustness features.

---

Hystrix library is designed to do this job. It helps you to control the interactions between these distributed services by adding latency tolerance and fault tolerance logic. Hystrix does this by isolating points of access between the services, remote system, and 3rd party libraries. The library helps to:

---

Netflix-High-Level-System-Architecture

Netflix works on two clouds AWS and Open Connect. These two clouds work together as the backbone of Netflix and both are highly responsible for providing the best video to the subscribers. 

The application has mainly 3 components:

---

microservice-architecture

In a microservice architecture, services should be independent of each other. For example, The video storage service would be decoupled from the service responsible for transcoding videos.

---

4.1. EC2 Deployed MySQL
Netflix saves data like billing information, user information, and transaction information in MySQL because it needs ACID compliance. Netflix has a master-master setup for MySQL and it is deployed on Amazon’s large EC2 instances using InnoDB. 


The setup follows the “Synchronous replication protocol” where if the writer happens to be the primary master node then it will be also replicated to another master node. The acknowledgment will be sent only if both the primary and remote master nodes’ write have been confirmed. This ensures the high availability of data.  Netflix has set up the read replica for each and every node (local, as well as cross-region). This ensures high availability and scalability. 

mysql",7.141247510910034," Judgement Response to Question about Optimize Storage Utiliziation in Netflix's design document for software development is Not Applicable, as the context does not provide information on this aspect specifically.  The text focuses more prominently instead upon data ingestion methods (Kafka and Apache Chukwe), fault tolerance mechanisms provided by Hystrix library to control interactions between distributed services in Netflix's microservice architecture system for video streaming service, as well details about MySQL database setup ensuring ACID compliance.
Explanation: The context does not discuss or mention any specific techniques used within the software development process at this application that directly relate with optimizing storage utilization efficiency and management in Netflix's design document specifically provided for understanding such aspects of their system architecture, hence my judgement as 'Not Applicable'.",27.128761053085327,0,"[Document(page_content='Netflix uses Kafka and Apache Chukwe to ingest the data which is produced in a different part of the system. Netflix provides almost 500B data events that consume 1.3 PB/day and 8 million events that consume 24 GB/Second during peak time. These events include information like:\n\nError logs\nUI activities\nPerformance events\nVideo viewing activities\nTroubleshooting and diagnostic events.\nApache Chukwe is an open-source data collection system for collecting logs or events from a distributed system. It is built on top of HDFS and Map-reduce framework. It comes with Hadoop’s scalability and robustness features.', metadata={'id': 'documentsFromText/Netflix/content.txt:None:25', 'source': 'documentsFromText/Netflix/content.txt'}), Document(page_content='Hystrix library is designed to do this job. It helps you to control the interactions between these distributed services by adding latency tolerance and fault tolerance logic. Hystrix does this by isolating points of access between the services, remote system, and 3rd party libraries. The library helps to:', metadata={'id': 'documentsFromText/Netflix/content.txt:None:21', 'source': 'documentsFromText/Netflix/content.txt'}), Document(page_content='Netflix-High-Level-System-Architecture\n\nNetflix works on two clouds AWS and Open Connect. These two clouds work together as the backbone of Netflix and both are highly responsible for providing the best video to the subscribers. \n\nThe application has mainly 3 components:', metadata={'id': 'documentsFromText/Netflix/content.txt:None:3', 'source': 'documentsFromText/Netflix/content.txt'}), Document(page_content='microservice-architecture\n\nIn a microservice architecture, services should be independent of each other. For example, The video storage service would be decoupled from the service responsible for transcoding videos.', metadata={'id': 'documentsFromText/Netflix/content.txt:None:7', 'source': 'documentsFromText/Netflix/content.txt'}), Document(page_content='4.1. EC2 Deployed MySQL\nNetflix saves data like billing information, user information, and transaction information in MySQL because it needs ACID compliance. Netflix has a master-master setup for MySQL and it is deployed on Amazon’s large EC2 instances using InnoDB. \n\n\nThe setup follows the “Synchronous replication protocol” where if the writer happens to be the primary master node then it will be also replicated to another master node. The acknowledgment will be sent only if both the primary and remote master nodes’ write have been confirmed. This ensures the high availability of data.  Netflix has set up the read replica for each and every node (local, as well as cross-region). This ensures high availability and scalability. \n\nmysql', metadata={'id': 'documentsFromText/Netflix/content.txt:None:33', 'source': 'documentsFromText/Netflix/content.txt'})]","The context does not discuss or mention any specific techniques used within the software development process at this application that directly relate with optimizing storage utilization efficiency and management in Netflix's design document specifically provided for understanding such aspects of their system architecture, hence my judgement as 'Not Applicable'.",Not Applicable,Not Applicable
